{
  "id": "weather.cold_snap",
  "description": "docs/16's cold snap: one to three days where every body reads one band colder, indoors too, unless a lit fire is near; shamblers slow to seven tenths -- the only state that weakens them directly -- food keeps twice as long, and scent carries less. Winter's kind. First cuts for the owner. Read by SimWeather only.",
  "durationTicks": { "min": 288000, "max": 864000 },
  "weights": { "spring": 1, "summer": 0, "autumn": 2, "winter": 5 },
  "tempShift": -1,
  "zombieMoveMul": 0.7,
  "spoilageMul": 0.5,
  "scentHalfLifeMul": 0.7
}
